{
  "schema_version": "1.0",
  "id": "institutional-work-summary-v1",
  "name": "Institutional Work Summary 15-Slide Template",
  "template_path": "template.pptx",
  "template_sha256": "59b104d31bf3f44c15d407adefe51425c9dcd8bb5c5d1e2212fb38753dc72839",
  "authorization": {
    "status": "user-authorized",
    "scope": ["template", "masters", "layouts", "media", "vectors", "charts", "embedded-workbooks", "skill-distribution"],
    "recorded_at": "2026-07-27"
  },
  "slide_count": 15,
  "supported_scenarios": ["business-report", "annual-review", "strategy-planning", "operations-review", "project-kickoff"],
  "text_style_rules": [
    {
      "id": "portable-display-title-fallback",
      "slide_numbers": [1, 3, 4, 10, 13, 15],
      "kinds": ["title"],
      "max_chars_lte": 1,
      "font_face": "Microsoft YaHei",
      "maximum_font_size_pt": 92
    }
  ],
  "slots": [
    {"id": "s01.year", "slide": 1, "shape_id": 26, "kind": "number", "max_chars": 8, "required": true},
    {"id": "s01.title.1", "slide": 1, "shape_id": 6, "kind": "title", "max_chars": 1, "required": true},
    {"id": "s01.title.2", "slide": 1, "shape_id": 7, "kind": "title", "max_chars": 1, "required": true},
    {"id": "s01.title.3", "slide": 1, "shape_id": 8, "kind": "title", "max_chars": 1, "required": true},
    {"id": "s01.title.4", "slide": 1, "shape_id": 9, "kind": "title", "max_chars": 1, "required": true},
    {"id": "s01.title.5", "slide": 1, "shape_id": 10, "kind": "title", "max_chars": 1, "required": true},
    {"id": "s01.title.6", "slide": 1, "shape_id": 11, "kind": "title", "max_chars": 1, "required": true},
    {"id": "s01.title.7", "slide": 1, "shape_id": 12, "kind": "title", "max_chars": 1, "required": true},
    {"id": "s01.title.8", "slide": 1, "shape_id": 13, "kind": "title", "max_chars": 1, "required": true},
    {"id": "s01.title.9", "slide": 1, "shape_id": 14, "kind": "title", "max_chars": 1, "required": true},
    {"id": "s01.title.10", "slide": 1, "shape_id": 15, "kind": "title", "max_chars": 1, "required": true},
    {"id": "s01.title.11", "slide": 1, "shape_id": 16, "kind": "title", "max_chars": 1, "required": true},
    {"id": "s01.en", "slide": 1, "shape_id": 29, "kind": "label", "max_chars": 36, "required": false},
    {"id": "s01.presenter", "slide": 1, "shape_id": 4, "kind": "body", "max_chars": 24, "required": true},
    {"id": "s01.date", "slide": 1, "shape_id": 19, "kind": "body", "max_chars": 28, "required": true},
    {"id": "s01.tagline", "slide": 1, "shape_id": 28, "kind": "label", "max_chars": 40, "required": false},

    {"id": "s02.item.1", "slide": 2, "shape_id": 20, "kind": "title", "max_chars": 20, "required": true},
    {"id": "s02.item.2", "slide": 2, "shape_id": 14, "kind": "title", "max_chars": 20, "required": true},
    {"id": "s02.item.3", "slide": 2, "shape_id": 16, "kind": "title", "max_chars": 20, "required": true},
    {"id": "s02.item.4", "slide": 2, "shape_id": 18, "kind": "title", "max_chars": 20, "required": true},

    {"id": "s03.kicker", "slide": 3, "shape_id": 20, "kind": "label", "max_chars": 20, "required": true},
    {"id": "s03.title.1", "slide": 3, "shape_id": 3, "kind": "title", "max_chars": 1, "required": true},
    {"id": "s03.title.2", "slide": 3, "shape_id": 4, "kind": "title", "max_chars": 1, "required": true},
    {"id": "s03.title.3", "slide": 3, "shape_id": 5, "kind": "title", "max_chars": 1, "required": true},
    {"id": "s03.title.4", "slide": 3, "shape_id": 7, "kind": "title", "max_chars": 1, "required": true},
    {"id": "s03.title.5", "slide": 3, "shape_id": 12, "kind": "title", "max_chars": 1, "required": true},
    {"id": "s03.title.6", "slide": 3, "shape_id": 13, "kind": "title", "max_chars": 1, "required": true},
    {"id": "s03.en", "slide": 3, "shape_id": 52, "kind": "label", "max_chars": 36, "required": false},

    {"id": "s04.kicker", "slide": 4, "shape_id": 20, "kind": "label", "max_chars": 20, "required": true},
    {"id": "s04.title.1", "slide": 4, "shape_id": 3, "kind": "title", "max_chars": 1, "required": true},
    {"id": "s04.title.2", "slide": 4, "shape_id": 4, "kind": "title", "max_chars": 1, "required": true},
    {"id": "s04.title.3", "slide": 4, "shape_id": 5, "kind": "title", "max_chars": 1, "required": true},
    {"id": "s04.title.4", "slide": 4, "shape_id": 7, "kind": "title", "max_chars": 1, "required": true},
    {"id": "s04.title.5", "slide": 4, "shape_id": 12, "kind": "title", "max_chars": 1, "required": true},
    {"id": "s04.title.6", "slide": 4, "shape_id": 13, "kind": "title", "max_chars": 1, "required": true},
    {"id": "s04.en", "slide": 4, "shape_id": 52, "kind": "label", "max_chars": 36, "required": false},

    {"id": "s05.title", "slide": 5, "shape_id": 7, "kind": "title", "max_chars": 28, "required": true},
    {"id": "s05.metric.1.label", "slide": 5, "shape_id": 15, "kind": "label", "max_chars": 10, "required": true},
    {"id": "s05.metric.1.percent", "slide": 5, "shape_id": 16, "kind": "number", "max_chars": 8, "required": true},
    {"id": "s05.metric.1.value", "slide": 5, "shape_id": 17, "kind": "number", "max_chars": 16, "required": true},
    {"id": "s05.metric.2.label", "slide": 5, "shape_id": 20, "kind": "label", "max_chars": 10, "required": true},
    {"id": "s05.metric.2.percent", "slide": 5, "shape_id": 21, "kind": "number", "max_chars": 8, "required": true},
    {"id": "s05.metric.2.value", "slide": 5, "shape_id": 22, "kind": "number", "max_chars": 16, "required": true},
    {"id": "s05.metric.3.label", "slide": 5, "shape_id": 25, "kind": "label", "max_chars": 10, "required": true},
    {"id": "s05.metric.3.percent", "slide": 5, "shape_id": 26, "kind": "number", "max_chars": 8, "required": true},
    {"id": "s05.metric.3.value", "slide": 5, "shape_id": 27, "kind": "number", "max_chars": 16, "required": true},
    {"id": "s05.metric.4.label", "slide": 5, "shape_id": 34, "kind": "label", "max_chars": 10, "required": true},
    {"id": "s05.metric.4.percent", "slide": 5, "shape_id": 35, "kind": "number", "max_chars": 8, "required": true},
    {"id": "s05.metric.4.value", "slide": 5, "shape_id": 36, "kind": "number", "max_chars": 16, "required": true},
    {"id": "s05.metric.5.label", "slide": 5, "shape_id": 43, "kind": "label", "max_chars": 10, "required": true},
    {"id": "s05.metric.5.percent", "slide": 5, "shape_id": 44, "kind": "number", "max_chars": 8, "required": true},
    {"id": "s05.metric.5.value", "slide": 5, "shape_id": 45, "kind": "number", "max_chars": 16, "required": true},
    {"id": "s05.callout.1", "slide": 5, "shape_id": 33, "kind": "label", "max_chars": 10, "required": false},
    {"id": "s05.callout.2", "slide": 5, "shape_id": 42, "kind": "label", "max_chars": 10, "required": false},

    {"id": "s06.title", "slide": 6, "shape_id": 48, "kind": "title", "max_chars": 28, "required": true},
    {"id": "s06.budget.label", "slide": 6, "shape_id": 11, "kind": "label", "max_chars": 12, "required": true},
    {"id": "s06.budget.percent", "slide": 6, "shape_id": 12, "kind": "number", "max_chars": 8, "required": true},
    {"id": "s06.value.1", "slide": 6, "shape_id": 14, "kind": "number", "max_chars": 10, "required": true},
    {"id": "s06.unit.1", "slide": 6, "shape_id": 15, "kind": "label", "max_chars": 4, "required": true},
    {"id": "s06.value.2", "slide": 6, "shape_id": 17, "kind": "number", "max_chars": 10, "required": true},
    {"id": "s06.unit.2", "slide": 6, "shape_id": 18, "kind": "label", "max_chars": 4, "required": true},
    {"id": "s06.value.3", "slide": 6, "shape_id": 20, "kind": "number", "max_chars": 10, "required": true},
    {"id": "s06.unit.3", "slide": 6, "shape_id": 21, "kind": "label", "max_chars": 4, "required": true},
    {"id": "s06.growth.label", "slide": 6, "shape_id": 25, "kind": "label", "max_chars": 8, "required": true},
    {"id": "s06.growth.percent", "slide": 6, "shape_id": 26, "kind": "number", "max_chars": 8, "required": true},
    {"id": "s06.pie.1.title", "slide": 6, "shape_id": 52, "kind": "label", "max_chars": 24, "required": true},
    {"id": "s06.pie.2.title", "slide": 6, "shape_id": 56, "kind": "label", "max_chars": 24, "required": true},

    {"id": "s07.title", "slide": 7, "shape_id": 9, "kind": "title", "max_chars": 28, "required": true},
    {"id": "s07.category.1", "slide": 7, "shape_id": 34, "kind": "label", "max_chars": 8, "required": true},
    {"id": "s07.category.2", "slide": 7, "shape_id": 53, "kind": "label", "max_chars": 8, "required": true},
    {"id": "s07.category.3", "slide": 7, "shape_id": 71, "kind": "label", "max_chars": 8, "required": true},
    {"id": "s07.category.4", "slide": 7, "shape_id": 74, "kind": "label", "max_chars": 8, "required": true},
    {"id": "s07.category.5", "slide": 7, "shape_id": 77, "kind": "label", "max_chars": 8, "required": true},
    {"id": "s07.total.1.label", "slide": 7, "shape_id": 92, "kind": "label", "max_chars": 12, "required": true},
    {"id": "s07.total.1.value", "slide": 7, "shape_id": 93, "kind": "number", "max_chars": 12, "required": true},
    {"id": "s07.total.1.unit", "slide": 7, "shape_id": 94, "kind": "label", "max_chars": 4, "required": true},
    {"id": "s07.total.2.label", "slide": 7, "shape_id": 102, "kind": "label", "max_chars": 12, "required": true},
    {"id": "s07.total.2.value", "slide": 7, "shape_id": 103, "kind": "number", "max_chars": 12, "required": true},
    {"id": "s07.total.2.unit", "slide": 7, "shape_id": 104, "kind": "label", "max_chars": 4, "required": true},
    {"id": "s07.total.label", "slide": 7, "shape_id": 138, "kind": "label", "max_chars": 16, "required": true},
    {"id": "s07.total.value", "slide": 7, "shape_id": 140, "kind": "number", "max_chars": 12, "required": true},
    {"id": "s07.total.unit", "slide": 7, "shape_id": 141, "kind": "label", "max_chars": 4, "required": true},
    {"id": "s07.table", "slide": 7, "shape_id": 20, "kind": "body", "max_chars": 260, "required": true},